{
  "task_id": "DSH-VISION-WORKFLOW-E2E-001",
  "source_commit": "56c6aafc554701b4a19da9691b369ba74fc978b9",
  "result_commit": null,
  "status": "PASS",
  "summary": "The repository-defined TEST_ONLY workflow completed successfully on the real local checkout. The task contract validated, all five project validation commands passed, no blockers occurred, and no product or unrelated repository files were modified.",
  "changed_files": [
    "docs/agent-results/DSH-VISION-WORKFLOW-E2E-001-result.json",
    "docs/agent-tasks/ACTIVE_TASK.json"
  ],
  "tests": [
    {
      "name": "node .agent-workflow/validator/validate-contract.mjs task docs/agent-tasks/ACTIVE_TASK.json",
      "status": "PASS",
      "evidence": "Exit 0: VALID TASK CONTRACT. main/LATEST resolved to 56c6aafc554701b4a19da9691b369ba74fc978b9 with a clean worktree."
    },
    {
      "name": "npm run typecheck",
      "status": "PASS",
      "evidence": "Exit 0 in both @ran-sh/dsh-vision and dsh-plugin-image-mind workspaces."
    },
    {
      "name": "npm run build",
      "status": "PASS",
      "evidence": "Exit 0; both workspace packages built their declared artifacts."
    },
    {
      "name": "npm test",
      "status": "PASS",
      "evidence": "Exit 0: 63 vision tests passed; 271 image-mind tests passed and 7 skipped; 42 root tests passed. Total 376 passed, 7 skipped, 0 failed."
    },
    {
      "name": "npm run test:package",
      "status": "PASS",
      "evidence": "Exit 0: 11/11 package-integrity tests passed."
    },
    {
      "name": "npm run test:built",
      "status": "PASS",
      "evidence": "Exit 0: 5/5 built-artifact tests passed after the build step."
    }
  ],
  "blockers": [],
  "result_path": "docs/agent-results/DSH-VISION-WORKFLOW-E2E-001-result.json",
  "notes": [
    "Repeated ES2024 target warnings and one Node DEP0190 deprecation warning were non-fatal.",
    "Seven pre-existing image-mind tests were reported as skipped by the suite; the npm test command itself passed.",
    "Only the Result Contract addition and required ACTIVE_TASK.json deletion are included in the completion commit."
  ]
}
